{
  "article_ids": [
    "73edd629-dfe3-47f5-964e-de43689db0d8",
    "cd8f929a-63c7-47e7-a7d2-47426558be0e",
    "90179dae-42f8-4347-a650-ab2506255282"
  ],
  "edition_date": "2026-10-29",
  "published_at": "2026-10-29T20:03:12-03:00",
  "schema_version": "1.0.0",
  "timezone": "America/Sao_Paulo",
  "title": "Edição de 29 de outubro de 2026",
  "visual_theme_id": "lab-2026-w43"
}
