{
  "article_ids": [
    "3d0f71a4-f3d9-4ebe-b40c-4f8859fca676",
    "ddc3879a-acb8-4c75-a615-274d34d81dfc",
    "7b099537-2d8d-44e1-bb08-5a2f77c4f143"
  ],
  "edition_date": "2026-10-27",
  "published_at": "2026-10-27T20:12:39-03:00",
  "schema_version": "1.0.0",
  "timezone": "America/Sao_Paulo",
  "title": "Edição de 27 de outubro de 2026",
  "visual_theme_id": "lab-2026-w43"
}
