{
  "article_ids": [
    "e6989909-de6f-430e-b427-416045f2adee",
    "c1972c08-69b1-4dcf-aaa5-ff539f956468",
    "73641c9b-1703-43fe-890d-a34c33113721",
    "c83d8ffb-f8be-426c-90eb-1f3f6f210e3b"
  ],
  "edition_date": "2026-10-28",
  "published_at": "2026-10-28T19:54:03-03:00",
  "schema_version": "1.0.0",
  "timezone": "America/Sao_Paulo",
  "title": "Edição de 28 de outubro de 2026",
  "visual_theme_id": "lab-2026-w43"
}
