{
  "article_ids": [
    "1686facc-470e-4518-b4c1-302dc5f46f73",
    "6981dbbb-0543-4e8c-bec2-180e1fbde1b7",
    "6cbb7818-031c-46c6-9513-80727792f1f9"
  ],
  "edition_date": "2026-10-19",
  "published_at": "2026-10-19T16:00:16-03:00",
  "schema_version": "1.0.0",
  "timezone": "America/Sao_Paulo",
  "title": "Edição de 19 de outubro de 2026",
  "visual_theme_id": "lab-2026-w43"
}
