{
  "article_ids": [
    "31947648-657a-41c1-a3e8-a3ba1efb81d1",
    "8fb2e010-30c0-494b-9c26-90aa3cc7748b"
  ],
  "edition_date": "2026-10-20",
  "published_at": "2026-10-20T12:56:39-03:00",
  "schema_version": "1.0.0",
  "timezone": "America/Sao_Paulo",
  "title": "Edição de 20 de outubro de 2026",
  "visual_theme_id": "lab-2026-w43"
}
