{
  "article_ids": [
    "df731954-bf32-496a-99d2-5b32b73603b7",
    "a60c7b8c-7da1-4e95-a621-f1bd7d07f96a",
    "88a9f86e-5804-48cf-8845-0d2def1be947"
  ],
  "edition_date": "2026-10-26",
  "published_at": "2026-10-26T19:28:42-03:00",
  "schema_version": "1.0.0",
  "timezone": "America/Sao_Paulo",
  "title": "Edição de 26 de outubro de 2026",
  "visual_theme_id": "lab-2026-w43"
}
