{
  "article_ids": [
    "be95e96e-ab00-4251-a199-6a9e252066c5",
    "0fa99193-b74a-4078-8daa-dd582181a146"
  ],
  "edition_date": "2026-10-22",
  "published_at": "2026-10-22T22:49:15-03:00",
  "schema_version": "1.0.0",
  "timezone": "America/Sao_Paulo",
  "title": "Edição de 22 de outubro de 2026",
  "visual_theme_id": "lab-2026-w43"
}
