{
  "article_ids": [
    "b255e0ce-8e4b-4753-80c6-655b9e68a50a",
    "6f4e89d5-afac-4dd6-a379-e8772e341406",
    "931bc354-e8b0-48a9-8fda-6cf1466aed8f"
  ],
  "edition_date": "2026-10-23",
  "published_at": "2026-10-23T20:05:34-03:00",
  "schema_version": "1.0.0",
  "timezone": "America/Sao_Paulo",
  "title": "Edição de 23 de outubro de 2026",
  "visual_theme_id": "lab-2026-w43"
}
