{
  "article_ids": [
    "009cd0c6-d2c5-4535-9029-126741051a64",
    "4f2f6955-76a7-4385-8f5a-841030cc510d",
    "191c33b6-0009-4454-98a2-b0cecf5281d4"
  ],
  "edition_date": "2026-10-15",
  "published_at": "2026-10-16T16:55:35-03:00",
  "schema_version": "1.0.0",
  "timezone": "America/Sao_Paulo",
  "title": "Edição de 15 de outubro de 2026",
  "visual_theme_id": null
}
