{
  "article_ids": [
    "0cdd42f5-59b0-4084-b9c6-2c324ed657a1",
    "950ef267-fccf-493c-b979-888bb8ccbe66",
    "00e1cf85-65bf-424e-88e7-60ff530187d2",
    "aca785bc-b87e-4509-9fef-9cd6693a78e4",
    "5df9d931-7f58-4934-b818-359b5898f535",
    "0e94fa84-16fe-448c-9e50-cbfc02fc24f4",
    "1a0e43e6-22fb-4bd3-a86f-53198d877666"
  ],
  "edition_date": "2026-10-16",
  "published_at": "2026-10-17T03:59:50-03:00",
  "schema_version": "1.0.0",
  "timezone": "America/Sao_Paulo",
  "title": "Edição de 16 de outubro de 2026",
  "visual_theme_id": "lab-2026-w42"
}
