{
  "article_ids": [
    "7a72fc17-be5d-4147-9ba6-ab76203c3849",
    "6aa36712-8819-41e8-a2c9-af2504e4ad04",
    "38f876de-7b18-4e32-a678-af1bb3ec3287"
  ],
  "edition_date": "2026-10-21",
  "published_at": "2026-10-21T18:08:00-03:00",
  "schema_version": "1.0.0",
  "timezone": "America/Sao_Paulo",
  "title": "Edição de 21 de outubro de 2026",
  "visual_theme_id": "lab-2026-w43"
}
